{
  "foodlab_transfer": true,
  "schema_version": "1.0.0",
  "transfer_id": "TX-C1D2E3F4",
  "transfer_type": "SHELF_LIFE_TO_QA",
  "source_module": "SHELF_LIFE",
  "target_module": "QA",
  "exported_at": "2026-07-16T00:00:00.000Z",
  "exported_by": "Local user",
  "workspace_id": "WS-A1B2C3D4",
  "source_record_id": "SL-C1D2E3F4",
  "payload": {
    "product_project_id": "PD-A1B2C3D4",
    "product_id": "PR-A1B2C3D4",
    "formula_version_id": "FV-A1B2C3D4",
    "sensory_project_id": "SN-B1C2D3E4",
    "shelf_life_study_id": "SL-C1D2E3F4",
    "product_name": "Plant Protein Bar",
    "product_category": "Snack",
    "planning_shelf_life_days": 180,
    "storage_condition": "20 °C, ambient, sealed package",
    "packaging_notes": "High-barrier flow wrap",
    "qa_parameters": [
      {
        "parameter_name": "Moisture",
        "unit": "%",
        "lower_limit": 8,
        "upper_limit": 12,
        "warning_rule": "Warn within 10% of either limit",
        "confirmed_by_user": true
      }
    ],
    "scientific_limitations": ["Planning value only; requires validated production specification"]
  },
  "metadata": {
    "application_version": "1.0.0",
    "notes": "User-confirmed limits only",
    "disclaimer": "Transferred limits are user-confirmed planning values and are not automatically regulatory specifications."
  }
}
